review,P/N
we spent last 18 months traveling around we were always looking for korean bistro to fulfill our desire for our favourite bibimbap this actually never happened because the best and only real bibimbap for us is the one that mr mrs lee are serving in their restaurant there is no better korean restaurant in english and spanish speaking world their recipes for kimchi and tuna soup are just perfect soup is so strong and tasty it is a cure for any weakness we went there yesterday after all those months new place in zizkov looks beautiful servers are super friendly and happy as always and the food the food was maybe even better then i remember my favourite combo is bibimbap in non heated bowl mr lee s classic it is not korean traditional but the rice stays soft all the time and not ower dry from warmth of the bowl soup and kimchi comes with the meal total price of czk150 is cheap for what you get and really good price point so everyone can afford this experience tuna sushi to share czk130 for 14pcs maxi roll yummy i just love this place must visit in prague for sure ,1
no fuss or gimmick in the restaurant style but when the food came it was beautiful in looks and the taste was fantastic the potion size was great not too big and definitely not small kimichi rice was excellent and the classic bimbimbap with salad was super we went at lunch and it was not overly busy highly recommended look forward to the next visit to try something else ,1
this restaurant used to be near my office and we went there almost every week thanks to bibimbap korea i was introduced to korean food and it was love at first sight i am very happy that even though they ve moved from near my office now they are near my home and we go almost every week for dinner delicious food esp bibimbap and really nice service for a very reasonable price the average item on the menu costs around 150 160 crowns i couldn t recommend this restaurant more ,1
so glad we found this restaurant via tripadvisor the food was amazing the portions were huge and i d recommend trying the delicious classical bibimbap the first dish on the menu we felt so welcomed by the friendly staff and owners we returned for dinner on the same day this was one of the highlights of our dining experience in prague and we ll definitely come back during our next trip ,1
small bistro with homemade korean food and homemade feel no design please great place to discover the cuisine for very reasonable price bonus the owner is very nice gentleman ready to share advice on your next trip to korea concentrate on food not on the appearance ,1
a very nice suprice for a fraction of money you would spend in restaurants in direct city center we recived hudge portions of dishes so tastefull that we just could not stop eating even we were full after half of the dish a must see place if you are in zizkov ,1
this is a gem you really won t want to miss especially worth mentioning is the bulgogi bibimbap second option on the menu right past the nomen omen dish bibimbap the ambience is cozy sweet very familiar what a nice find in prague ,1
nice people very good and healthy food i m surprised by the quality the price is unbeatable in that sense second time i come and will do again,1
outstanding korean food love that they have a variaty of different bibimbap instead of just the normal btw the normal bimbimbap is served like the dolsot bibimbap in hot stone bowl i had the one with pork meat and it was great lovely spicy taste prices are absolutely fine and definitely worth the money seems like they have lunch offers aswell female waitress even spoke korean ,1
i ve been to a couple of korean places around prague but this one is my favourite the menu is quite simple but the bibimbap is delicious and they have a selection of kimbap as well to help my frequent kimbap cravings what i love is that their bibimbap comes with such good and plentiful veggies that it s more or less a healthy dinner in my possibly not especially objective opinion the owner is super sweet and talkative and is clearly very proud of his little establishment ,1
we stopped by for lunch after reading the previous reviews and weren t disappointed both of our dishes were fantastic we can recommend the bibimbap number 1 one of the best we ve had authentic and tasty and all for a reasonable price it s quite nice to dine in exactly as pictured and there s wifi the owner and all the staff were friendly and welcoming definitely recommend if you re in the area ,1
this place is a must try the food is wonderful the staff is smiling and great i had a sundubu jjigae and i enjoyed it greatly it was my first korean food experience in prague and i have no regret ,1
excellent taste especially to korean tourists who look for real korean foods the bibimbab that the restaurant serves is the best one that i have ever eaten outside korea ,1
one of the best korean restaurants ive ever been yet very cheap try the kimchi if you like traditional korean dishes the owner is a nice guy smiling all time ,1
nase nejoblibenejsi restaurace se skvelou obsluhou a vybornym jidlem the best korean food and service in prague ,1
great korean cuisine very friendly staff and reasonable prices i m coming back to eat through the whole menu ,1
we were very surprised to find a korean restaurant in prague and especially one this good the service is very friendly and the food is great the best thing we had was the kimpap or gimbap we have had this many times before and i think this was my favourite one we also had the ramyeon which was really good for a cold night and bibimbap in a stone bowl was nice but could do with some more vegetables it s very reasonable priced to eat here so order a bottle of soju and enjoy ,1
we visited this restaurant because of the recommendation of one of my friend the owner of the restaurant was very helpful as it was our first visit of the korean restaurant we also took the rice wine which was bit unusual but great if you want to try something new come here ,1
i went here with my friend it was difficult to find a food that is not spicy my kimči pokum bap was basically rice with red curry paste and fried bits of carrot and yammi egg on the top it was really cold cleaning spicy food and i enjoyed it a lot yellow tea i took it without honey sugar and it was not my favourite kind of tea it tastes as burnt rice it wasn t my favourite taste but i drank it and felt good afterwards it was a lovely experience to taste the spicy food with refreshing rather sour salad the price was great for the food we got our budget was to stay under 200 czk for one meal and one drink per person and we did manage without problems the atmosphere was simple it s not a place where i would go for interior design but food was my goal this time and it exceeded expectations the serves was really friendly and explained all tastes and combinations i really appreciated it i will come back again ,1
delicious hearty meal with genuinely friendly and caring service the only downside is the waiting time about 45 minutes for two mains but the freshness of the food is certainly worth the wait ,1
my girlfriend and i were craving some korean food and this really hit the spot it s very difficult to find decent authentic korean food in europe so this was a really lucky find food is good service is friendly and prices are reasonable don t miss out ,1
its a new resturant that opend 4 days before we arrive the manger and his wife were so nice and the food was amazing prices were good its first time i ate korean food and i felt like im in a dream im speechless,1
we visited in an early january lunch time only the two of us and a student in another table all the food were very mediocre when we started to think the pork bibimbap was quite good the rice was piping hot but when we put the pork in the mouth they were fridge cold so just ate the rice without the pork when we mentioned it after paying the server said the pork was precooked and stored in the fridge they forgot to warm it up before putting them on the rice ,1
free byo but have a couple of beers available food was a really interesting range of flavours many familiar some not decent portions well presented felt slightly expensive for more of a cafe than a restaurant but was happy with value at the end of the day ,1
i m quite confused about how this places gets good reviews for a plate of vegetable dumplings fried squid that was thin and covered in panko and oily and a plain plate of beef short rib 15 bulgogi without rice or anything we paid 33 what the actual help the portions were tiny too we were given tap water in a re usable pink plastic water bottle you use to take water on your bicycle and then at the end of the meal 2 slices of orange on a plate by far the most bizarre and most expensive meal we have had which was not worth even 5 to make we felt this was some kind of joke still can t quite believe it both of us a size 10 we went for food afterwards unbelievable ,0
my friends an i have thoroughly enjoyed our dinner at seoul gaja formerly known as dain korea pancakes squid bibimpap so good great taste kind of spicy but not too much i ve only tried seafood but i m looking forward to going back and try other stuff the service is fast of polite definitely cheap considering the quality of the food highly recommended ,1
the setting is quite basic and if you want a fancy setting then it would be better to go somewhere else the focus is all on the food here which was amazing i loved the plain setting it added to the ambiance and authenticity of the food which was delicious you can see part way into the kitchen and there s an honesty about that too the portions were generous and the service was excellent i can see why it is such a favourite you can have a super meal here at a very reasonable price especially if you bring your own drinks ,1
the menu includes a large variety of different korean dishes portions are big and food is tasty we were given a free starter of salad kimchi and radish cash only staff were friendly note the name has changed to seoul gaja ,1
lovely delicious food and service think it s change it s name now to seol but same establishment korean spicy chicken especially tasty atmosphere could do with attention though as a bit too basic ,1
a group of us ate here last month the group consisted of vegetarians meat eaters and myself who at the time was followed a vegan diet everyone of us was pleased with the dishes we chose and the complimentary kimchi and salads i am looking forward to returning again ,1
some of the best food i ve had in months looks completely forgettable from the outside but as soon as you step inside you ll know it s something special incredibly attentive waiting staff cheap yet plentiful portions of incredible food booking essential on weekends ,1
always very welcoming wide selection of typical korean dishes extra sauce provided if you want it hotter we had noodles rice dishes and fish prawns all very tasty with complimentary salads and raw pickles very very tasty especially chicken and vegetarian dumplings well worth a visit to this friendly korean restaurant with delicious ginger tea ,1
we booked out the whole restaurant for a group of about 30 people and everybody had a wonderful time the food was great really flavourful and tasty and the service was excellent too i was so impressed with the speed at which they brought out 30 orders and made no mistakes at all because i think that many people can be quite tricky to manage all in all it was a wonderful meal ,1
incredible food me and my friend ordered the 26 set menu thinking it would be just enough for the two of us and it was so much food amazing value for money and brilliant quality which is rare in this day and age the staff were friendly and efficient and the service was very quick a quirky and delicious little spot for all occasions 10 10 ,1
i heard great things about this restaurant from a korean friend they weren t wrong myself and 15 friends had dinner here for my birthday the setting itself is average but the smells coming from the kitchen enhance the atmosphere tenfold each person ordered a few different dishes the tables were full to the brim i can honestly say that every single dish was incredible the menu is full of choice i d recommend trying a few different things and sharing the only thing that let this experience down was the service there was one waitress working and found it difficult to accommodate the 16 of us ordering took a really long time as she had trouble understanding what we wanted the menu is numbered so we thought it would be simple enough but she said she didn t know what each number was subsequently she then wrote down a few of our orders incorrectly but hey the food completely overshadowed that one small issue will be returning frequently ,1
went for lunch today and really enjoyed it food was authentic and very tasty will definitely return to try more from the menu ,1
the food and the service are overall good but i was not really impressed it was my first time in a korean restaurant so i might need to increase the sample i would try it again ,1
still the best bipimbap i ve had in bristol great little place on my first visit they even gave helpful instructions on how to eat this korean delight mix it all together and tuck right in ,1
have had dinner here quite a few times each time ordering korean dishes and a few sushi dishes all food super tasty and authentic,1
excellent food the noodles are amazing all good was great perfect with family and they were helpful with our young child super friendly staff and great value ,1
we went in a group of at least 20 and everyone enjoyed their food and the fact that it was byob lol very much as someone who is allergic to both nuts and sesame it was also a bit of treat to be able to safely eat asian food the staff were very receptive when i explained my problemos i highly recommend getting the udon kimchee soup it revitalised me to the max ,1
really good service of two lovely young waitresses but i just don t know if i liked the food it was either extremely spicy or sweet the restaurant itself was a bit grubby it could do with a lick of paint throughout and it would really brighten the place up ,1
the food is amazing very authentic and the size of dishes is more than enough prices are very reasonable but you can only pay by cash will definitely go back ,1
i booked this for a birthday celebration and chose the banquet options the food was flavoursome and delicious and because it s byo the evening was even better value too we were a large party in a small restaurant but the service was always efficient and friendly but great for couples small gatherings and families too i ve recommended some dishes but it was all delicious,1
i ve been eating here for a few years with no complaints but when we ate here recently they said they are no longer serving sushi it s still on the menu which is a bit misleading i usually have a beef bibibap which is delicious but decided to try something else and had some starters and seafood yaki soba i agree with other reviews the starters are a bit expensive and the yaki soba was bland and not very nice my friend wasn t that impressed with his meal choice either the service was a bit patchy which i can forgive if the food is good but sadly this wasn t the case this visit i would still highly recommend the bibibap menu and please can you can start serving sushi again thank you ,1
first time going to a korean restaurant we had very reasonable meals agree that the starters are a bit expensive but there is complimentary kim chee and also pickled radishes there are also japanese dishes on the menu so there were things that all in our group could eat there were a few things on the menu that weren t available on a friday night which was a bit unexpected dessert for one but we were very happy to have eaten here and my daughter knew many of the korean songs so she was happy too bibimbap excellent whether vegetarian beef chicken or raw beef byo also ,1
an amazing array of korean dishes came to the table in no particular order as they were cooked it made for an interesting meal the restaurant is plain in decor and it doesn t need to make an effort as the food speaks for itself it is byo which makes it reasonably priced but not cheap the food was spicy hot and flavoursome and we enjoyed all that we ordered ,0
been here several times because it is byo which is great recommend number 75 on the menu can t remember what it is called but it is spicy and comes absolutely boiling hot so takes a while to eat also reccomend the bibimbap if you don t like spice as much you can add as much hot sauce as you like then you mix up all of the dish and it is delicious would say avoid the starters as they are very expensive 5 7 and you don t get as much compared to the mains good place for a birthday meal staff are great ,1
in contrast to the more westernised korean pan asian spots in bristol this place is a good shout if you re looking for the real deal it s byob which is most definitely a plus in terms of value but implies a casual milieu would recommend for an impromptu dinner with friends we were all very satisfied with our food excellent kimchi although i found the menu to be quite extensive and so it took some time for me to decide i plan to visit again to try some of the more adventurous menu items ,1
visited dain korea as a family for an evening birthday meal was not disappointed it s tucked away and is definitely not what you expect from the exterior the waitress was lovely and attentive easily explained ingredients of particular dishes we visited as a group of four and over ordered the side dishes are very generous almost a full meal in themselves and we were given plenty of banchan korean side dishes to accompany our meal food was delicious 2 4 had seafood dishes that were perfect no nasty after effects either super spicy and warming dishes main meals plenty it has a byob policy on larger quantities of alcohol but does serve 2 types of asian beer along with soft drinks would 100 reccomend visiting we ll definitely be back ,1
went for a date night meal with my girlfriend and was not disappointed the food was delicious and the staff were friendly and very helpful if you like korean food then you must give this place a try ,1
our son has been asking us to eat in a korean restaurant for some time and this weekend we tried it this restaurant is just a small very unassuming basic establishment on bristols bohemian gloucester rd the decor is very street food style the staff very welcoming with a smile the menu is quite extensive and unless you have some guidance it is possible to select the wrong dish i has a sweet beef style dish accompanied with iceberg lettuce and a soya bean sauce my son had a dish with mixed veg and an egg on top and my wife had a chicken glass noodle one all really tasty and cooked well its byo and they offer free water we will return ,1
my partner who lived in korea has been bemoaning the lack of good korean food in bristol we stumbled on dain korea by mistake and went a bit wild when ordering food dumplings korean pancakes rib broth and bibimbap later we were stunned and happy everything was authentic and tasty and we enjoyed the restaurant s relaxed byob approach ,1
having heard good things we my girlfriend and i were excited to have dinner at dain korea last night unfortunately it didn t live up to the hype my yaki soba chicken was distinctly lacking in chicken and was generally bland and tasteless and my girlfriend s spicy seafood soup was oily and didn t have much to it this is one place we won t be going back to ,0
bristol is full of different cultures and cuisines that come with such a diverse population dain korea offers a mixture of korean and japanese cuisine i came here for the korean food and was not disappointed ,1
such a nice korean restaurant nothing posh but tasty healthy and affordable food you can bring your own drinks and the guy who attended us was really nice i ordered bibimbap with row beef and it was really good more than enough food 100 recommended ,1
must try ive lived in korea before and the dishes are all up to standard the service is good and it is great value i recommend the kimchi soup la galbi and the mandu will go whenever im in bristol ,1
as a head chef myself i have to say that was thee best food i have ever eaten what ever you are paying you re chef pay him some more the man was born to cook ,1
so many times we ve just pitched up with a like 20 people sometimes more and they just deal like yeah it s nothing yo here s some bang up kimchi and other yommy foods you bring your own booze and they supply the food i love the bi bim bap cos you just get to stick the chopsticks in and mix it up and shovel it into your mouth soooooo goood i literally love it thanks dain ,1
we really enjoyed our meal here on friday night delicious food good service and it s bring your own booze which makes it a cheap night out ,1
been going to this restaurant for a while the staff is super friendly and the food is amazing you even get the little kimchi and radish as a starter which is brilliant also for those that never tried it so they can have a bit of a taste before ordering the bbq is cooked in the kitchen instead of at the table but it tastes lovely so it s still worth it would also advise the tang su yuk for a starter if you re a fan of sweet and sour ,1
good value for money food with great service and impressed of trying korean food for first time i will definitely revisit,1
increds food ignore the questionable shop front branding the food is hashtag amazeballs order the korean bbq it s different levs totes like ,1
staff are really helpful large selection of dishes food was good but not excellent in my opinion i enjoyed side dishes and accompaniments better than main ones,0
went for a meal on tuesday with my wife and have to say we both left with big smiles on our faces initially the decor does not look that promising but that is not really the point here it is functional and clean however the food is what makes this place a real find we had a starter of prawn mandu which are like gyoza lovely flavour with a beautifully crisp edge for mains i had the beef bibimbap which was beautifully flavoured essentially a rice dish but once all the ingredients are mixed in the bowl as is the custom the texture and flavours are luxurious and finely balanced my wife had a noodle dish which was just as good they do sell some alcohol but you are welcome to bring your own for a small corkage definitely will be making a return visit,1
i went there a few days ago and i have to say that it was one of the best meals i ve had in recent years the staff were really attentive and helpful the interior looked really nice and the food was amazing i am really looking forward to the next time i can visit i would recommend this to anyone looking for delicious korean food ,1
love this place i come about once a month everyone i take just adores it too delicious food good service and amazing value for money ,1
went to dain korea for a small party the food was nice and the service very good they were very accommodating and happy for us to decorate etc we didn t feel rushed and was a really nice atmosphere bring your own alcohol too which is great reasonably priced and their hot pots are really nice i ve had better sushi but wasn t bad my only gripe was that it took them a very long time to clear our table once we d finished eating but only a minor thing would recommend ,1
highly recommended this place took me back to my time in south korea authentic korean soul food that i dearly missed seeing the chef attend all tables and asking how the food was really blew me away something i haven t seen in a long time great touch definitely felt the love in the cooking most of all its veggie friendly no pork in the broths thank you for the great experience and catering for vegetarians our new favourite restaurant ,1
went there twice not disappointed i would say it serves a more authentic taste compared to the others simple place but with great food price range from 10 to 15quid a person i d recommend the sundubu jjigae kimchi soup but the pancakes are very nice too ,1
the restaurant is very simple and basic the service is a bit slow but the food is great you can bring drinks from outside a recommendation always ask for information about what the dishes are spicy sometimes they are too ,1
having the best sampled the best of korean restaurants in new malden surrey i was excited to hear of a korean restaurant in bristol visiting with friends from london on a wednesday night i was a little disappointed to see it was a korean and japanese place and was even more disappointed in the menu there was key korean and japanese dishes but not enough of either however the korean pork dumplings were not shop bought and very tasty always a good thing the bib am bab was very average not something i d be rushing back to have ,1
had a staff night there on thursday 17 03 2016 we were a table of 6 and i can tell that we all felt the same way the food was really good and fresh however service was not that good we asked for 6 wine glasses byob by the way and we had to ask them to change three of them as they were really dirty one of them even had some salad on it then we ordered some starters to share which were all great and 6 main course as 5 of us had our meals served after 45 minutes wait after we finished the starters which were not cleared from the table one of us didn t get his meal we had to ask the waiter for the 6th meal which they forgot about i noticed during the dinner that other tables were not cleared until someone else was arriving overall a descent restaurant with good prices but a poor customer service experience ,0
