review,P/N
we d never had korean before and i d been wanting to try this for a while we let our server know we d never had it before and she gave us some recommendations we ended up going with the beef bulgogi and the dolsot bibimbap both were great it is important to know that some of the food is season to taste so plan to add some of the table sauce and soy sauce to make it how you like it the appetizer sides that came with each entree were great too service was excellent and everyone was very friendly lots of regulars while we were there ,1
i really was unsure of how much of the menu would appeal to me at korea house but i went with a large group that order several dishes they were all excellent my favorite dish was the seafood pancake but really enjoyed the chicken bulgogi fried dumplings and fried rice as well i definitely recommend korea house it s not fancy but it s good food also the staff were great dealing with our large group and the food came out fast and hot you can bring your own wine for a 5 corkage fee ,1
absolutely delicious authentic korean food served in a no frills tiny space in an otherwise drive by shopping center on charlotte pike go early or late to get a table or just plan to take out the wonderful small trays of side dishes that come with every meal come first and are so good they ll be gone before your food arrives ours were and the bibimbap is worth driving across the state for ,1
the banchan or side dishes that they serve are what i love about this restaurant there s about 8 different kinds and they re very consistent in terms of quality preparation and taste i also regularly get the doenjang jiggae usually to go the place can get crowded pretty quickly at peak meal times there aren t too many tables and no waiting area ,1
my eleven year old twins beg to get biminbop on days off of school we drive 45 minutes for the best around ,1
dont go here for ambiance but if you want bulgogi mandy soju great lunch the meal comes with rice and about 7 seven other side dishes radish and cabbage kimchi marinated bean sprouts tofu egg dish sweet radish etc get a cold soju to split or barley tea split an entree because you get such a large serving yummy it s a good meal service is fast and pleasant plenty of parking locals koreans also eat here worth a drive ,1
quick visit for lunch first time eating korean food this place isn t big or fancy but it s small and friendly and the food is excellent i can recommend the chicken bugolgi ,1
heard great things about korea house and decided to take dh here as a surprise dinner for our anniversary wow i m not a huge korean food fan but dh loves it i figured i could find something here and boy did i yum e as recommended by others the chicken bulgogi was delicious don t skip the fried potstickers dh said they tasted like the ones in seoul he had the bibimbop and said it was delicious as others mentioned the place is small with kitchy decor service and food quality were 100 and top notch i m all in on the korea house we ll be back ,1
one of our favorite places nothing much in the decor but service and food are wonderful i will say that i ve eaten there more than 10 times and only have gotten the chicken lettuce wraps they re so good that i can t bring myself to order anything else pretty small place we only go on off times ,1
this is a small but very good place specializing in authentic korean food and not fusion they offer numerous delicious hot soups as well as awesome hot pork and other meats the place is very good ,1
korea house is a tiny strip mall restaurant close to sylvan park we went for dinner on a thursday and were able to sit down immediately i noticed that some folks were getting to go orders so that is an option as well the service was good and the food explained to us when we asked i have zero experience with korean food but i found everything tasty the side dishes are fun prices are moderate and parking plentiful this is a very casual place they do take credit cards ,1
today i went to korea house i was assigned to south korea from 1991 1993 and i developed a love of korean food i had bulgogi and several small side dishes like kimchi pickled radishes pickled bean sprouts etc the dishes were all delicious and the service exceptional if you have an affinity for korean food i recommend korea house ,1
i ordered the chicken bulgogi and the flavors were phenomenal i got it with regular heat which is spicy but tolerable to finish the meal the vegetables were mixed and sautéed well portions were very appropriate for someone with a large appetite rice was sticky and moist without being mushy there was a bit of wait as it was very crowded but i would say it s worth the wait they make up in quality what they are lacking in ambience and decor the staff was nice and quick ,1
my first experience with korean food i was skeptical that i d like it but i absolutely loved everything on the table tiny little place that stays busy very reasonable prices and the food is deeeelicious friendly staff authentic food and atmosphere love this place ,1
this is one of the best restaurants in nashville small place but the service is awesome the food is amazing i live everything about it ,1
our first time here made me wonder if i d ever had a korean dish like this before it is a simple restaurant i told the waitress i wanted something with pork and she told me to get the bulgogi my wife had the beef version many cold side ms served with it along with lettuce to we assumed use for eating similar to a lettuce wrap except these were longer skinny romaine leaves i think food was very tasty ,0
i need to be more adventurous here and get more than bibimbap or korean bbq but both of those things are so so good here that i rarely stray generous portions full of vegetables nice touches like freshly fried eggs on top and those steaming clay bowls are awesome they bring out a lot of sides banchan to the table for everyone to share good variety of dishes like kimchi bean sprouts potatoes etc staff is always welcoming and friendly all those awards are well earned ,1
hands down the most authentic korean experience i ve had back in the states the food is delicious and prepared by what appears to be a family make sure to eat your fill while you re there because korean food has the tendency to make itself known in the fridge i ve seen some complaints about service but they operate just like restaurants in korea do you ve got to tell them you want something and it ll be on the table in no time flat the only downside is that i didn t have the stomach to eat everything on the menu they basically have all of the classics that you could possibly want if i lived closer this would be a weekly spot ,1
my wife and i both enjoy korean food very much but it is very difficult to find in many cities in the south this restaurant was rated as the best korean food in the nashville area so we tried it i had the kimchee soup with beef and mary had bulgogi we were served the traditional little side dishes with our meal and these are always my way of separating the good from the very best the kim chee itself was on the rather tame side i did not request the really dilish hot stuff and am sorry i did not however it was very good and the soup was outstanding to the last drop and it was served in a huge bowl which i lifted and drained just like i used to do in korea the bulgogi was also very good the service was friendly and helpful and relatively fast and the prices were reasonable if you want to try korean food this is a very good place to do it with good food and a large selection to choose from i cannot remember the name of the red paste they always bring in a side dish which looks like ketchup but i can say that it is what stole the show for me here i dipped everything i could in it and it was scrumptious ,1
four folk for dinner staff explained all dishes even going into detail for the newcomers next to us who d not had korean food tasty dishes ample sized portions simple unadorned storefront no ambience at all save good food noisy when crowded expect to speak loudly and be heard by others at close in tables ,1
this restaurant has delicious korean food we recommend the bibimbap and the galbi they make their own kimchi and it is very tasty their service is quick and friendly the restaurant is busy at lunch on the weekend ,1
very small restaurant in a strip mall most authentic korean food ive hade in a long time their service is great but the food is excellent,1
decided to have my last lunch of 2016 at korea house i know there s a chinese new year but is there korean new year the iphone didn t capitalize korean new year but did for chinese new year so i guess not anyway back to korea house located in a strip mall along charlotte pike it s a rather small and unassuming restaurant we had a party of six and were at immediately but we also arrived at open i can see where this place would fill up rather quickly because of the small size as my first time here and i think my first time at a korean place i skimmed the pictures on here and got a couple tips from some friends who d ate here before i went with the chicken bulgogi 14 99 i wasn t sure what it was but the bulgogi seemed like the popular thing on the menu it came with a bunch of different sides we had a table of 6 and they brought out two ordered of sides for the table the portion for the chicken bulgogi was large it also came with a container of steamed white rice i mixed some of the rice in with the main dish and put a little of the sauce from the bottle onto my plate it was a little spicy but not insanely spicy i enjoyed it and would probably get it again if i went back ,1
the beef japchae and bulgogi are to die for and their bibimbap is toasty and filling great place for lunch and dinner go early because the place fills up fast the owner is on site and the staff are very friendly and helpfull can t say enough good about this restaurant ,1
i love korea house i was introduced to korea house 2 3 years ago and immediately was hooked wonderful food friendly staff i highly recommend korea house if you are looking for a korean food fix,1
this nashville restaurant is nestled in a little strip center on the west side there are about 12 tables and you may have to wait a bit if you show up during prime time but it will be well worth the wait the service is great and the food is spectacular very flavorful great sized portions the staff is very good at suggesting something if you aren t quite sure what to get the prices are fair food is great no excuse not to go there ,1
the food was amazing however the restaurant has won best of eleven years running i asked the owner if i had applied the correct sauce whereupon she took my chosticks from my hand and prepared my dish that was so awesome ,1
i stumbled across korea house by accident while in search of another location nearby what i found was an incredible eating experience i got so much food and every bite was good i can t wait to take my wife there someday ,1
this restaurant never disappoints we where all in need of comfort food and the staff at korea house provided it will style and warm smiles ,1
this is a fantastic hole in the wall that is always full to the brim of people who don t speak english you know a restaurant is great when it seems to be a gathering place for the local community of wherever they happen to be from the service is fantastic the food authentic and its all very well priced this is a not a fancy place so don t expect frills but do expect fantastic food ,1
we had family dinner at korea house and it was amazing food is the best takes a little time to get it but they always busy worth the wait very nice and friendly people wish they would expand their restaurant ,1
i have never dined in i just order it to go i always get the bulgogi with extra gochujang each time there s always something different included the meat is seasoned perfectly ,1
in today s world of cookie cutter chain restaurants and the thing of the moment menu items it is so rewarding to find a family owned restaurant presenting the ethnic food of their home country and they present it well and at a tremendous value four of us began with the wonderful seafood pancake accompanied with a sauce the waiter explained to us simply as pancake sauce just wonderful then we ordered an entree of beef of shrimp of pork and the kimchee rice we all had to laugh when we received our food with the companion dishes that come with any entree order we had covered every inch of our table with various dishes and sauces i won t list everything we ordered previous reviewers have listed their own favorites but it was all good and some great especially the seafood pancake and we finished every morsel no reservations so come early or you will wait for a table ,0
the food here is absolutely fantastic always consistent if you re looking for ambiance this is not the place for you ,1
the food is excellent and the staff super friendly the restaurant looked very clean with good light and seating the price is reasonable and the food memorable i live about an hour and a half away and have traveled to nashville just to eat here before they give you a very large portion along with the sides everyone at my table always leaves with a doggie bag or a doggie cup if they got soup the only downside is the restaurant is very small and everyone loves the place so if you come during the lunch or dinner rush be prepared to wait in line ,1
i would give korea house a 4 5 it can t get a 5 simply because of the atmosphere it is totally a dive that said the food is excellent the dolsot bibimbap is excellent the bulgogi is also very good the service is average the value is great i would have no problem giving them a 5 if the atmosphere was a little nicer and the service a little better that said i would recommend this place to anyone ,1
you can t get better korean then at the korean house food is spectacular and the service is great expect a short wait but well worth it we try to go at least once a month ,1
arrived early on a friday night and when we left at 6 30 the line was out the door tried soup bbq beef pancake and bibimbap bibimbap was the best all of the sides were delicious too tiny place ethnic feel great food ,1
delightful little family korean cafe this was my first experience with this cuisine and it was pleasant the kimchi fried rice with pork and fried egg was very good the portion was huge and combined with the veggies was an awesome sized lunch service was friendly a return visit to sample other dishes is assured ,1
don t go for atmosphere it s a strip mall storefront with a small dining room but the food it came out fast and it was wonderful the staff were busy but still friendly and efficient i will be back ,1
those of us in the nashville advertising community are a fairly tight knit bunch joe and i made a date for lunch and he suggested korea house on charlotte sure thing was my reply when i arrived on the scene joe was seated and i told him as i sat down that it was my first time not only at korea house but also to try korean food his immediate response was that he assumed i d been there with his cousin judy also an advertising vet and dear buddy of mine the place was shabby chic populated by diners who were largely seemingly korean a korean tv station was on the screens followed joe s lead and ordered the 16 dolsot bibimbap rice topped with vegetables and beef bits and a fried egg in a hot stone pot when our dishes arrived on he table they were literally sizzling the waitress with a beautiful smile had brought us small dishes of assorted additions to mix into our stone pots we mixed and blended the results were a delicious cacophony of flavors have to confess upon entry i was a bit worried glad i followed joe s lead with 16 just really great going back for sure thanks joe for introducing me to korea house totally enjoyed a new nashville favorite ,1
family owned authentic korean food the food is very delicious and in very reasonable price waitress are very nice and helpful highly suggest to anyone want to try authentic korean food with very unexpensive price ,1
my 1st time for this cuisine made even more pleasant w my lunch around the world group of 10 server jennifer was understanding about our cluelessness re korean food and kindly made a suggestion to help firm my choice and several others made the same decision yummy beef veggies rice served in a hot iron pot topped w egg the place is small and clean unencumbered by décor but welcoming to an almost capacity lunch bunch who seemed surprised to see our 10 seated perhaps in their usual spots we ll be back ,1
this was my first time experiencing korean fod and it was great two of us ordered beef bolgogi and one of us chicken bolgolgi it was very good and plentiful portions the kimshi was amazing cabbage cucumber and other we will do this again looks like a hole in the wall but don t let that stop you from experiencing great food and service ,1
you may not give this restaurant a second look if driving down charlotte but it s definitely worth the stop the food was delicious and hot both temperature and spice and you get a lot of it some lunch items were served in a steaming stone pot that kept the food cooking throughout the entire meal the menu is authentic korean cuisine with nearly 100 options to choose from however it s not somewhere to go if you are looking for a quick business lunch lunch lasted about 90 minutes it s also not good for large groups go with a group of 4 or less ,0
this is where i take my family whenever we are celebrating i love to share the food of my mother s side of the family with mine my kids love to go it s a treat every time i don t know what people are saying about the service i ve been going here for years and always have a friendly face eating here you can t go wrong ,1
we have been to korea house a few times the food is consistently good and is pretty cheap overall i order the bimbimbap with beef which comes with all the classic korean side accompaniments it comes out served in a hot stone or clay pot so that the bottom of the rice gets extremely crispy which makes it absolutely delicious another staple we normally get is the beef ribs they come with scallions and a wonderful sauce on a hot plate i absolutely love their house made hot sauce it is like a korean style sirachai sooo good the only things we haven t been huge fans of were the seafood pancake and the tripe soup the seafood pancake was almost inedible because it was so fishy tasting even with having a few dishes we would never order again the food is consistently pretty good service is ok its not fine dining or even like a regular restaurant the set up is a little cramped style but is normally full because its probably the best korean in nashville ,1
as out of towners we asked my bro where he d like to dine for his birthday we ended up at korea house initial impressions were not great little strip mall tiny crowded room folks standing in line outside should have been our first clue the service was slow but the food was oh so wonderful like beef bulgogi bibimbap eight sides to share fresh ingredients served hot authentic flavors dynamite experience and would like to sample other menu items soon ,0
korea house is not about appearances it s a simple square dining room about 20x30 feet in diameter tables sit as close together as possible and you can sit side by side in the center section i love it authentic cuisine and native language customers make this diner a fun wonderful place the smells emitting from the kitchen are full of spice and flavor before you even taste it all the dishes i see make my mouth water i m having the fried dumplings and the galbi pork short ribs i m writing this as i wait any time i get around good food i get excited there is nothing better than being able to enjoy wonderful cuisine in a relaxing speed food does not need to be hurried and this one is not fried dumplings are perfect small enough to be bite size crispy and flavorful conversation and someone to share with might make it better but my love affair with the food here kinda puts that on the back burner main meal arrived eight sides and a big platter of meat it s hard to start the kimchi varieties tofu potatoes ribs just so good it has taken me a few but i m back to finish this up sides are never ending always a bonus when they are good i feel like this is an anticlimactic end but i am very satisfied this is definitely a bring someone back place ,1
the food is excellent highly recommend the dolsot bibimbop prices are a little steep 11 30 service isn t the greatest it was our first time at a korean restaurant so when we would try to ask questions they were short with us or would just walk away when the woman brought the sides out we asked what they were and the woman as she was walking away said sides we knew that we wanted to know what each one was so when she walked back by i stopped her and asked what was in each one and she just did not want to tell us i finally just asked if any had fish since i don t like fish and was told one did but i would still go back because the food is that good ,1
my husband and i love korean food so we are always on the lookout for a good authentic korean restaurant because we travel to nashville several times a year we asked around and were directed to korea house the first thing i noticed when walking into the small restaurant was the amount of korean people having dinner good sign if you are looking for authentic korean food second thing i noticed was how well worn everything was in a nice homey way another good sign to me we ordered bulgogi one chicken one beef and dolsot bibimbap the food is amazingly good so flavorful and spicy the sides were great i especially love the kimchi and the bean sprouts our server mixed the bibimbap for us and it was perfect we will continue to frequent korea house whenever we are in nashville as the food is great on a side note the first time we visited the server we had a young woman was not very nice she was almost hostile for some reason we ordered three meals so we could share a little of each and take the rest back with us to eat over the next couple of days unless my teen son gets hungry then it is one meal she had the nerve to look at us and say that s a lot of food and just stood there so what we were paying for it so why the concern the second time our server was an older woman and she was awesome couldn t have asked for a better sever she sealed the deal for us as we had planned to look elsewhere if the service had been as poor as it had been the first time she brought us boxes for our leftover food and didn t bat an eye when we ordered three meals ,1
service is so bad here go to hai woon dai instead first of all the food here is very good but i live 90 miles away and this is the 2nd time in a row i ve been turned away i called ahead since i was running behind and they said be there by 9 30 and it would be okay i arrived at 9 20 and the owner still turned me away the previous time i waited in line til 9 30 but was turned away even though i arrived at 9 00 i will not be back again from now on i will go to hai woon dai where the food is just slightly less quality than that at korea house imo but the hospitality at hai woon dai is worlds better they remember me each time and i only eat at hai woon dai a few times per year ,0
we used to live in los angeles frequenting local korean restaurants for some of the most delicious food on earth after escaping to tennessee we realized how much we missed that authentic korean flavor it had been years since bulgogi or bibimbap had delighted my languishing tastebuds that is until the day a friend mentioned korea house it was exactly what we needed yes it s a cramped but the food was great and at the right price we ll be visiting again very soon ,1
went here with a friend my tab was 18 hers was 29 so we split the tab and he has me rung up as 18 and then when i hand him my card he quickly adds to it to make it 29 and then changes my friend s to 18 so quickly you wouldn t even know it without saying a word these people are rude if not criminal i let it go as a mistake but it s grown on me i felt the need to put in a negative review it s upset me so much it s old korean man who works there at the register i should have refused but it s only 10 but the more i think about it the more angry i become because he did it so purposely and so blatantly and then of course doesn t understand english i do not recommend this was practically criminal the food was okay the younger woman is nice there s some old lady probably the man s wife who came up without saying a word and just flung the food down on the table do not recommend do not come here and pay with credit card this sleezeball will quickly pull a bait and switch and pass it off as not being able to understand english scum ,0
very good compact setting with ample portions unique tastes seemed to be very popular with locals,1
three of us had lunch and even though we only ordered two main courses we had way too much food we started with fried pork dumplings and a seafood pancake which were very good the seafood pancake was closer to a pizza than a pancake because it had so much seafood in it it was better after the waitress suggested putting soy sause on it we forgot that they put out complimentary appetizers and that is why we had too much food there were about six small plates with different things really liked the potato the fish and stayed away from the kimchi its too hot for us my daugter ordered a beef dish and i ordered the chicken fried rice i did t try hers but she liked it and i liked my dish i definitely would recommend giving this restaurant a try ,1
