review,P/N
close to apollo victoria made good sense for pre theatre dinner the staff were friendly and efficient helped with the order as we never eat korean before the food was good not too spicy very tasty and flavoursome place was busy tables were close but didn t seem as crowded at some of the other posts suggest certainly recommended,1
the portions were hearty for the price we paid the waiter was lovely and was always smiling we ordered starter and mains and it was the typical korean dishes would come here again ,1
good service good food simple menu i ordered what is best described as a sizzling bowl of rice pork and vegetables squeeze in a load of chilli sauce and mix it all together tasted great my only criticism is that whilst the atmosphere was vibrant it s one of those places when you re sat almost touching the person on the next table very noisy busy and hot ,0
if you fancy something a bit different for lunch this place is great would advise to book as it was very busy great service great food settings very basic but don t let it put you off ,1
my only negative comment restaurant was a bit tired looking but service was incredibly friendly and prompt atmosphere was good and the food was amazing brought to the table very quickly on sizzling hot plates for a very reasonable price will definitely return if we re in this part of london again ,1
it was my very first time in a korean restaurant with real korean food served since i love korea and know some of their dishes i tried the kimchee spicy calamari and a bibimbap dishes everything was very good i was soooo full at the end there was even space for some soju which was great very nice place near victoria station to enjoy this type of food kind and nice waiter and waitress that made it more enjoyable i will surely return ,1
my first korean meal and i very much enjoyed it our party had a selection of reasonably priced tofu beef and chicken dishes piping hot though unusually the side portion of spinach is served at fridge temperature some unusual drink options for the adventurous the place was full on weekday lunchtime good idea to book friendly service ,1
i was grabbing a quick meal before catching a train so ordered two starters i was disappointed in the bolgogi beef salad as the beef was served cold and the salad itself was overdressed the glass noodle salad with the same bolgogi beef but served hot was so much more pleasant other koreans do serve their salads with heated beef and it helps the flavour really come out nicely not particularly a warm experience no real welcome or send off but i would pop back in if i was craving asian near wicked or the victoria station and in a hurry ,0
an interesting place even if i am not particularly keen of plain simple corean food yet the starters are very good specially the dumplings and fish pancake ,0
i was so hungry at the time when i went but luckily the salmon i ordered was big and delicious the waiter was friendly and the food was served fast would definitely return but bad news is that the queue is always quite long ,1
good food good price but we had the impression they want us to leave soon as there was a queue otherwise i enjoyed ,1
so pleased with my dinner waiter was so nice about explain the dishes for me and solved my garlic issue i choose a chicken noddle without garlic that turn out amazing ,1
small place seated about 30 i guess just next to victoria station it s a small korean food place narrow room with tables down one side so atmosphere is limited but don t let that put you off as the food really is top notch and very reasonably priced the chicken starter we had was served pipping hot and very tasty the main was served with obvious fresh vegetables and again tasty fresh and hot the prices were good starters from 4 8 quid and mains from around 9 quid upward sides a couple of quid service was quick friendly and efficient a meal for two with starters mains and a beer was basically 50 quid not bad for central london in summary food quality superb taste very service quick and efficient value not bad fair prices hope this helps ,1
fantastic helpful friendly staff food perfect wine nice and sensibly priced wish we found before will be back,1
lovely little restaurant with delicious food reasonable pricing and pleasant staff easy walking distance from victoria station thursday evening it was buzzing white wine needs to be chilled more the main courses arrived shortly after the starters so a little erratic it s a noisy restaurant when full ,1
close to victoria station this little outlet serves fresh and authentic korean fare not a very extensive menu but adequate sampling of all the old favorites their bulgogi and bimbimbap are both excellent and the portions more than adequte fairly quick service with a smile and helpful staff would go again,1
i used trip advisor to find a restaurant suitable for a theatre dinner lime orange seemed a good choice and we were delighted with this tiny place i would never have entered the restaurant had it been by looks alone as the exterior is not very inviting but once inside the door the room was clean quite smart and we were shown to our table by a very polite and friendly waiter we got a table at 5 30 with ease and soon after the tiny restaurant quickly filled up we were given advice about food choices the bbq chicken was delicious and sizzlingly hot and the pork bibimbap was equally good although we ordered rice with the chicken we didn t need it as we shared both dishes and there was plenty for two ladies the service was very quick and friendly as they are very used to people going to the apollo victoria theatre which is immediately across the road ignore google maps advice as that will direct you to the back entrance ,1
the exterior of this korean fusion restaurant is rather uninspiring do not be put off by this we had read reviews online so knew it had a good reputation we were not disappointed from the moment we met our charming host and were led to our table and through the variety of dishes we felt relaxed and welcome the food was delicious we shared a dish of kimchi followed by hot stone pot biminbap and a spicy chicken bulgogi with fresh lettuce on the side we arrived early pre show and did not reserve a table from 18 30 it would be necessary to book as the restaurant filled up rapidly it was a thoroughly enjoyable meal ,1
on the 11th of july 2016 we had tickets to see the wicked theatre show after picking up our tickets at the box office we were looking for a quick but good quality meal before seats opened for the show and a place close to the apollo victoria theatre based on tripadvisor reviews we chose to visit lime orange with a family of four two adults and two daughters one hour before seats open for wicked we ordered fried calamari for starters then bibimbap soup and noodles with fried chicken everything was tasty and stupendous in flavour texture and temperature it was our first experience with korean food but based on this first encounter i m sure more will follow our daughters who at first protested as we were visiting asian again really loved the tasty food service was fast and helpful and accommodating highly recommended ,1
definitely worthy going there it is always busy in fact i went there with 3 girlfriend and we really enjoyed the food the portion are medium small ,1
my first experience of korean food but had my friend and helpful waiter to guide me food was excellent and full of flavour portions generous slightly disconcerted about starters and mains etc arriving all at the same time we went for lunch and place was very busy you can book but only by phone prices are very reasonable and a stones throw from victoria station a great find and will return ,1
the menu consists of the standard fare bulgogi and bibimbap but the preparation and flavors here are spectacular the beef appetizer in particular was scrumptious prices reasonable and service very cheerful seating is typically rustic korean with lots of wood ,1
not only is the food fantastic and delicious but the customer service was above and beyond when my 9 year old couldn t finish her noodles they not only made up a doggy bag but held onto it for us when we went to wicked as we weren t allowed to take it into the theatre so she had the fanciest packed lunch on monday at school double delights we will definitely visit again i loved my bimbimbap dish and the calamari starters were perfecct ,1
i m shocked that i have lived in this area for over 10 years and have only now discovered this wonderful local restaurant it s conveniently located right next to victoria station but unless you are visiting the apollo theatre right opposite or are a commuter taking the bus outside the restaurant it s easy to miss vauxhall bridge road certainly isn t the most scenic road so probably not too many people just going for a stroll in the arae however i can only recommend taking a detour for this little gem all the dishes i have ordered so far have been excellent i particularly liked their japchae every day they have a different special lunch dish and for 3 99 take away or 4 99 eat in it s incredible value for money for london in general but particularly for this area portions are generous it s casual dining at it s best the furnishing may be simple but the ambience feels relaxed and somehow always has a calming effect on me even when the restaurant is packed this may also be thanks to the wonderful staff always very friendly quick and helpful ,1
the restaurant is conveniently located near to victoria station just behind the wicked theatre nice restaurant ambience and great service staff the food was also really good e g the bibimbap the lighting in the restaurant was a bit dim when you look from afar so i was mistaken that it s closed until i take a closer look glad i didn t turn away in the end ,1
food was amazing specially the sweet and sour calamari for starters and the bibimbap selection we also chose to get 3 selections of their grill and bbq my friends and i stayed for for around 3 hours with some tea and desserts afterwards and the staff took care of us the whole time and was very friendly ,1
had a mixed seafood bibimbap and if you havent tried one they should definitely be experienced served with several vegetables and rice in a hot heavy dish mix it all together for a great tasty meal,0
eaten here a few times you can t book before 7 and it does get really busy at this time it s near victoria station so maybe pre theatre and commuters account for this but worth the short wait for a table if necessary food is great value fresh and tasty the staff are very friendly too ,1
i visited here on a tuesday night with two friends and were lucky to get a table as i know it can be busy the wine was good and not too and the food we had was delicious we ordered a mixture of starters and then all had a main and we were stuffed full as the portions are a good size and we couldn t stop eating would definitely come back here the staff were so lovely and didn t rush us once even though we waited a long time for our 3rd party member to join us food came out quickly too a great wee place thanks ,1
it might not be the kind of place to take your bird on a first date but a fantastic place to go for a work lunch food is good some of the best korean food i have eaten in london decent price it can be busy so it may be worth booking ahead if there are a few of you ,1
i was taken here by a friend we shared two starters both were excellent i having never had korean food i was unsure but this put me at ease for mains we had be sizzling bowls of veg with an intact egg yoke mine also had chicken this was filling and interesting but not quite at the same level of yumminess but fully palatable and filling maybe owing to my own eating style by the end the food had blackened to the metal bowl and was less tasty to be fair this was just the dregs so shouldn t put people off the food for desert we had green tea ice cream the taste of this was excellent what was more questionable and i think a marmite option was the texture it had green tea in it so was bitty i am still undecided if i liked it my friend definitely didn t however two colleagues at work both said they love the bits so i guess try and see its only a couple of quid i would come back korean food was tasty filly and fresh ,1
we visited as a group of 4 adults and 4 children and found the service and food to be excellent we didn t book as we turned up when it opened but by around 6 on a thursday night it was very busy not sure if the staff were on different shift patterns but the waiter was extremely busy on his own for the 1st hour which was ok for us as we was the first ones in so no issues with service jap chae glass noodles was a bit small for 6 70 for a starter but it was very flavoursome bimbibap was excellent and very tasty bbq meat was also very good and tasty lighting was a bit dark which meant sometimes it was a little hard to tell if the meat was cooked ,1
i stumbled in the restuarant just by coincidence it was a good suprise great food authentic and the portion are good too it s a bit busy but worth it i recommend it ,1
found this little gem by chance doesn t look like much from the outside but the quality of the food is excellent and prices more than reasonable and their bibimbap is amazing ,1
i was introduced to lime orange korean and japanese restaurant a few months ago and it has now become one of my favourite lunch places the restaurant s ambience is simple but the food is very good home like cooking the staff are very friendly and ready to assist you with your choice of food food is also served quickly which is quite efficient if you only have a one hour lunch break never tried dinner at this place but should also be good above everything the prices are very reasonable recommendable but is usually very busy especially for lunch ,1
good selection of korean and japanese food restaurant gets busy early but worth the wait for a table ,1
tried for the first time today for lunch very friendly service and good tasty tofu bibimbap loved the rice crust at the bottom from the red hit bowl price reasonable and speedy service too will return ,1
my partner have visited lime orange on a number of occasions over the last few years and have always had a great meal the food is fantastic the staff are very friendly and it is good value for money as well i like how the staff are also happy to show you how to eat certain dishes if you are unfamiliar with the cuisine much appreciated the first time i went there ,1
looking for a byte before wicked found this place the service was polite quick and efficient the food special and tasty started with vegi dumplings which were excellent following came a bibimbap that exploded with flavors an ice cream made from black sesame was interesting and completed the meal the whole experience was good and right on time considering the fact that i ve splurged on wicked the cost here was just right ,1
i was the only non korean in here the night i ate which is usually a good sign i had the japchae and it was very good the prices were in keeping with the area ,1
it s far better in korean town the fried rice is terrible without flavor the field chicken is ok but fried too deep therefore hard to bite ,0
good food reasonably priced for london 35 head very small restaurant so best to avoid disappointment by booking service a little slow at times but polite and efficient once food order placed ,0
i ve not eaten any korean food before but read the reviews here so thought i d give it a go as i was off to see wicked which is just across the road i had the beef bibimbap which really tasty watch out it comes in a red hot bowl the house wine wasn t amazing but it was fine enough fab food served in an un pretentious little place it was pretty busy but i was on my own so not too much of a problem if there is a group of you it might be best to book in advance ,1
i went to have dinner here with my family and friends thoroughly enjoyed it was full service was fast and food was warm and tasty ,1
visited before the wicked theatre with the kids and i must say the food was mind blowing i had expected similarity to chinese food but i was very wrong the bibimbap i had was fantastic 8 vegetables with egg yolk and chilli sauce and the fun part was that you had to mix everything in to get the full flavour the staff were very friendly too explaining all the best selling dishes and recommending a few to the kids who had no idea what they wanted overall a very pleasant experience would recommend to friends and family passing by victoria ,1
went here for a work friends leaving do friendly staff help you understand menu if you get stuck i had spicy egg chicken noodles and boy they are hot not for the faint hearted accompaniment of seaweed and cucumber and pear it was lovely aloe vera juice and black sesame ice cream fast service fast food well worth a visit,1
a friend and mine stopped into this place as we were walking around the area just sight seeing looking for a decent priced restaurant that had some spicy options didn t know what to expect but was pleasantly surprised also note that they don t take american express so make sure you have cash or a different credit card ,1
small korean restaurant in victoria service is hectic but efficient and always friendly the food is good and prices are reasonable even unbeatable when it comes to the daily special ,1
welcoming helpful staff nice atmosphere starters of chicken katsu and veggie mari were good as was yummy spinach side both had bibimbap for main which was delicious only quibble would be being served main courses half way through starters was told would stay hot after stirring it was warm only as beef had gone cold would have preferred hot and not like i had to rush my starter as main was already there not great choice of puds but you ll be full by then anyway ,0
this is my favourite korean restaurant so far the dishes are tasty rather than just greasy and spicy and the portion sizes are ok you don t leave hungry the bulgogy is absolutely amazing although it doesn t come cheap at the end of the day as you pay seperately for all the bits but worth it they do lovely drinks as well ,1
we were late because the underground was delayed but the staff couldn t have been nicer and more helpful we had the bipimbap which arrived very quickly and was delicious we thoroughly enjoyed our meal thanks x,1
food was really good and waitstaff really helpful we were shown right way to eat the food as i was not familiar with it bibimbap super delicious ,1
i came to know this restaurant after a series of research in narrowing down the best korean restaurants that fits our criteria including price range location atmosphere etc i was a little sceptical at the beginning as there weren t a lot of reviews on tripadvisor for this place despite the high ratings to be fair lime orange isn t one of the most well known korean restaurants in town but we like how it is one of the few that s close to my friend s hotel at south kensington as most korean restaurants are gathered around tottenham court road holborn area the restaurant itself is very easy to find as it is located on the main road right opposite apollo theatre known as the theatre for wicked the musical price range is also very reasonable and the quality of food is no less than that of the better known korean restaurants such as kimchee the portion of food is also very decent for appetizers we had jap chae a small dish of korean glass noodles it was the best jap chae i had in london vegetable mandu 5 korean dumplings they were very crispy and a small bowl of kimchi it was quite spicy but it would be better if there was more depth in flavour rather than spice alone for main course we had a beef bibimbap a kimchi soup pot which actually gives you a complimentary bowl of rice but it isn t specified on the menu i quite like the pork that comes with it and fried seafood udon i like the flavours and the wide variety of seafood between the four of us we had a really enjoyable meal as it was a nice casual place to dine and chat the only downside for us is that the staff could have been a little bit more attentive by serving water regularly or perhaps just look around more often otherwise everything was perfect in general though the staff there are all very friendly on a final note the bill came down to 40 which was 10 quid pp you definitely get more than you pay ,1
lovely casual korean restaurant always packed and people queuing to get in friendly staff good value for money bimbimbap rice great and large portions also serves green tea ice cream it s very close to victoria station def give this place a try for casual tasty eating ,1
lovely little restaurant serving delicious korean food the bibimbap was fantastic and came with soup too the vegetable dumplings were great too friendly and quick service very convenient for victoria station i m looking forward to returning very soon ,1
we had lunch in the restaurant which is right opposite the entrance to the apollo victoria theatre the surrounds seem a bit basic but the food was tasty and the service excellent dishes are japanese thai korean and the portions are generous i was pleasantly surprised at the cost lunch for 5 people including a bottle of wine and service came to 16 a head which is amazing for central london just the place for a pre theatre lunch ,1
very nice had a salad with cold beef as a starter and a miso soup pot with seafood vegetables and tofu with a bowl of rice as main course tasty very friendly staff decent price recommended ,1
nice meal in a great location the food was presented well and was tasty i had seafood pancakes for my starter it was far too big a portion and would have filled me on its own i did not finish it the starter was tasty but a bit stodgy i did not like the chili sauce they gave us to accompany the meal my main course was a pork dish served with rice and lettuce this was tasty again presentation was good a two course meal for two with one of us having sake and one of us having two bottled beers came in at around 40 for central london that s terrific value the restaurant is quite basic on the inside and the toilets were pretty shocking they looked like they hadn t been cleaned for quite a while and there was a bit of a smell that s my main reason for not giving a 5 star review it s not a posh restaurant but it was tasty filling and service was good recommended if you re on a budget ,1
lime orange is a basic looking restaurant more in a cafe style with a unexciting low level view of vauxhall bridge road but despite that it was just what we had been looking for the service was faultless the food bibimbap etc delicious though the red chili paste was dispensed from what looked like a ketchup tomato bottle and came to about 15 head for lunch would definately recommend ,1
this was our first korean experience it was fantastic our waiter was helpful advised us what to try both my husband i agreed the calamari was the best we ve ever had the black sesame ice cream was out of this world we can t wait to come back ,1
i have come here for lunch many times but haven t got past the three favourites monday daily special chicken katsu and udon noodles wednesday spicy beef soup which is a chili oil flecked consommé soup with bean sprouts scallions bits of beef and slices of a mild winter vegetable i drown the accompanying bowl of rice in it both go great with a side order of kim chee the healthy cabbage and chili the total damage then is about 8 20 they do bibimbap very well that works out at around 10 the tofu option was my favourite they also do chicken beef pork or seafood only seafood untested others fine too service is quick and courteous place gets full though best advice is to arrive early like 12 to 12 15 solo diners have a stool and bar looking out of the window option place is near victoria station due to crossrail civil engineering project this area has become a bit of a food desert lime orange is recommended ,1
bibimbap is delicious and the best i ve had portion is huge staff are friendly and food is very good on a previous visit i also had the veggie pancake which is nice too highly recommend,1
went with a large group of friends after the theatre without booking in advance staff were very accommodating and the service was very efficient food was extremely good with a varied korean and japanese menu excellent value will definitely go back ,1
we went here for a pre theatre meal i was impressed by the way they explained what everything was and made really sensible recommendations the service was smooth and attentive and this was a great opportunity to try something new there was a range of different dishes and they were keen to help us choose something that was balanced for our tastes on a future visit i might push myself a little to try something a bit more experimental but i trusted the staffs suggestion to start with something i was more used to i will very definitely return here and i recommend the green tea ice cream ,1
i love oriental food and i have always had great korean food in london this one is absolutely one of the best for food quality and great value ,1
been here twice this month the food was amazing both times the gentleman was extremely helpful and friendly i would highly recommend this restaurant great value for money,1
coming from the provinces we were struck by the sight of young people having an early evening meal in working clothes presumably prior to going home the food is good and the staff helpful in navigating the unusual menu a restaurant deserving of its pleasing reviews ,1
